{"artifact_status":"test-only","chain_manifest_digest":"sha256:b6087607e3c2d3473127afa7578c94e2e2fd95397c9ad917c5daeb5999564f7b","chain_tree_digest":"sha256:b6a93affa4271f9e040c6d49fbe3d9d07a3e0af795dd53dcbcc02e30477d580e","exact_paths":["chain-manifest/public-release-status-chain-manifest.v0.1.json","public-release-status-chain-output-set.v0.1.json","revisions/0001/public-release-status-set.dsse.v0.1.json","revisions/0001/public-release-status-set.v0.1.json","revisions/0002/public-release-status-set.dsse.v0.1.json","revisions/0002/public-release-status-set.v0.1.json"],"files":[{"file_digest":"sha256:9de7bd459217c236c327c56e4339a6ab1f9de787075ff8c26c5ec2a9e8eb2fcb","path":"chain-manifest/public-release-status-chain-manifest.v0.1.json","role":"status-chain-manifest","size":2101},{"file_digest":"sha256:7ff72d054749fdebe9d319c3ae0fc71aa9bad02b462d718c93528e63d0af46f7","path":"revisions/0001/public-release-status-set.dsse.v0.1.json","role":"status-signature","size":2357},{"file_digest":"sha256:58f1e964cd3cdc88cbb450228b31d27e9221531ff8a7aed5b84b5bc45085cbc2","path":"revisions/0001/public-release-status-set.v0.1.json","role":"status-set","size":1461},{"file_digest":"sha256:033043ad6e0d9294aa52d753da4503cac56070fc9af568d37425684b687711b7","path":"revisions/0002/public-release-status-set.dsse.v0.1.json","role":"status-signature","size":2457},{"file_digest":"sha256:6a9d45ef1f1762f4c5c82eeb09d53a1cf597e1b26f4e8eaa8be9262913029f09","path":"revisions/0002/public-release-status-set.v0.1.json","role":"status-set","size":1535}],"latest_revision":2,"latest_status_set_digest":"sha256:aa976446d369799641fe19cb813d490c9d9471c87b460b22c68850c2dbc56c99","output_set_digest":"sha256:25c6ca0bb250343ef6d3cc2b6aa119893aca398bbc4093b831e80fa764732ebc","schema_version":"0.1","self":{"digest_field":"output_set_digest","path":"public-release-status-chain-output-set.v0.1.json"},"trust_domain_id":"itdo-private-match-assurance-fixture-v0.1"}