{"artifact_status":"test-only","chain_manifest_digest":"sha256:735ac652eb6be61078c7541d72353db9e8722e5893086c8674f8dda5d0e76406","chain_tree_digest":"sha256:425638d130568fea370c16e57a09dfabc1091f0f800008be62772f0e55fc3d1e","exact_paths":["chain-manifest/public-release-status-chain-manifest.v0.1.json","public-release-status-chain-output-set.v0.1.json","revisions/0001/public-release-status-set.dsse.v0.1.json","revisions/0001/public-release-status-set.v0.1.json","revisions/0002/public-release-status-set.dsse.v0.1.json","revisions/0002/public-release-status-set.v0.1.json"],"files":[{"file_digest":"sha256:f132f5fd9dad41a6df89ccc7498b67391ee4ad6f798b615bbd1e8e7aa25cf7d3","path":"chain-manifest/public-release-status-chain-manifest.v0.1.json","role":"status-chain-manifest","size":2101},{"file_digest":"sha256:12879b1a9facf3ab4c64965713e8af9aa88d6165b11a2ee897578f976347f0bc","path":"revisions/0001/public-release-status-set.dsse.v0.1.json","role":"status-signature","size":2357},{"file_digest":"sha256:a8c51ada0ecfb01b1d73833fcbc216e8405460754d51f1b6bf431ff92af06fb7","path":"revisions/0001/public-release-status-set.v0.1.json","role":"status-set","size":1461},{"file_digest":"sha256:93a67d1e50f4c2c0900e0c4a982dbfa6cf4e073fa7bdabf68a0b303cc3f0b4a6","path":"revisions/0002/public-release-status-set.dsse.v0.1.json","role":"status-signature","size":2609},{"file_digest":"sha256:57456e492a91038835d46adba42cd6b600c5178de065021849e345f1be3b582e","path":"revisions/0002/public-release-status-set.v0.1.json","role":"status-set","size":1648}],"latest_revision":2,"latest_status_set_digest":"sha256:3adee1f38963a556fba32035b186aa2aad59ae4ae1621fdaaa06ab6b632a23c4","output_set_digest":"sha256:c8b93d88bc4c1acf8262b6499e252ab3f884dc613fe1dcf1d38603faa2d95a8a","schema_version":"0.1","self":{"digest_field":"output_set_digest","path":"public-release-status-chain-output-set.v0.1.json"},"trust_domain_id":"itdo-private-match-assurance-fixture-v0.1"}