{"artifact_status":"test-only","chain_manifest_digest":"sha256:2aa71e37e69b04aaa759a0a44c513a860bd6ebf736baa85090a82f79e8c1abb7","chain_tree_digest":"sha256:04795d4b306c1b9360582e3dd581e63fe4e77b81ac96ec0b65892abf3d90ec14","exact_paths":["chain-manifest/public-release-status-chain-manifest.v0.1.json","public-release-status-chain-output-set.v0.1.json","revisions/0001/public-release-status-set.dsse.v0.1.json","revisions/0001/public-release-status-set.v0.1.json"],"files":[{"file_digest":"sha256:7136cff49b3db831546c2fb0b3d01bad449cc5fba7555ed5ded2280cbe55042f","path":"chain-manifest/public-release-status-chain-manifest.v0.1.json","role":"status-chain-manifest","size":1499},{"file_digest":"sha256:7ff72d054749fdebe9d319c3ae0fc71aa9bad02b462d718c93528e63d0af46f7","path":"revisions/0001/public-release-status-set.dsse.v0.1.json","role":"status-signature","size":2357},{"file_digest":"sha256:58f1e964cd3cdc88cbb450228b31d27e9221531ff8a7aed5b84b5bc45085cbc2","path":"revisions/0001/public-release-status-set.v0.1.json","role":"status-set","size":1461}],"latest_revision":1,"latest_status_set_digest":"sha256:ad7b523b1d0d48b1579c2090677e4eb9018cb62e5c8c4b7e14e4777a2b83397a","output_set_digest":"sha256:5f7c850b1a3122cda68d429175976ea291e4d701c5ad86b2e27e814a9e4abcff","schema_version":"0.1","self":{"digest_field":"output_set_digest","path":"public-release-status-chain-output-set.v0.1.json"},"trust_domain_id":"itdo-private-match-assurance-fixture-v0.1"}