{"artifact_status":"test-only","chain_manifest_digest":"sha256:4f323fd4e29b6e85909a52a6fbf57f3e537f9729f93e5dac9a19bf7c55a7ce03","chain_tree_digest":"sha256:e81d93c90d097171ce1c6f060df03219374d9361b6806bc9e59abf5dd8b4bcef","exact_paths":["chain-manifest/public-release-status-chain-manifest.v0.1.json","public-release-status-chain-output-set.v0.1.json","revisions/0001/public-release-status-set.dsse.v0.1.json","revisions/0001/public-release-status-set.v0.1.json","revisions/0002/public-release-status-set.dsse.v0.1.json","revisions/0002/public-release-status-set.v0.1.json"],"files":[{"file_digest":"sha256:a24bc94cd5ac4762426665cc97dae59b7d8b7d4b960f60572f27f4df4d41d99e","path":"chain-manifest/public-release-status-chain-manifest.v0.1.json","role":"status-chain-manifest","size":2101},{"file_digest":"sha256:7ff72d054749fdebe9d319c3ae0fc71aa9bad02b462d718c93528e63d0af46f7","path":"revisions/0001/public-release-status-set.dsse.v0.1.json","role":"status-signature","size":2357},{"file_digest":"sha256:58f1e964cd3cdc88cbb450228b31d27e9221531ff8a7aed5b84b5bc45085cbc2","path":"revisions/0001/public-release-status-set.v0.1.json","role":"status-set","size":1461},{"file_digest":"sha256:3a3d8517c1aec26223a8bf6b0e8a3c65e2624f8dcdb269aad9f30f40a9b7e0a5","path":"revisions/0002/public-release-status-set.dsse.v0.1.json","role":"status-signature","size":2453},{"file_digest":"sha256:dfff3c7d25650e7b60121c53485591b50584fbd4acf9a3fc2ded9e2f8c836ee1","path":"revisions/0002/public-release-status-set.v0.1.json","role":"status-set","size":1532}],"latest_revision":2,"latest_status_set_digest":"sha256:744d6cdb87f919162cf3414223eca9cafd658b99837de81af5e604d1a2bd8aa2","output_set_digest":"sha256:2dba42abee3b6b9da3a59fd8d7a44135c8238df15bd450170a192575795d76bc","schema_version":"0.1","self":{"digest_field":"output_set_digest","path":"public-release-status-chain-output-set.v0.1.json"},"trust_domain_id":"itdo-private-match-assurance-fixture-v0.1"}