{"artifact_status":"test-only","chain_manifest_digest":"sha256:6dae97e07e6d2391c1926b95bd6d79e60c0c83d202bb5e83850d968272f9da8c","chain_tree_digest":"sha256:908f4ea8a8d657c1137e14e3543d05fb9f997013c544f4ce1f4c37f14f586f2b","exact_paths":["chain-manifest/public-release-status-chain-manifest.v0.1.json","public-release-status-chain-output-set.v0.1.json","revisions/0001/public-release-status-set.dsse.v0.1.json","revisions/0001/public-release-status-set.v0.1.json","revisions/0002/public-release-status-set.dsse.v0.1.json","revisions/0002/public-release-status-set.v0.1.json"],"files":[{"file_digest":"sha256:98073f8bcf11835fc3874c16b157baef98c88e164cc57b30f6c4c558094c9137","path":"chain-manifest/public-release-status-chain-manifest.v0.1.json","role":"status-chain-manifest","size":2101},{"file_digest":"sha256:3545379b463d9d46f85ce0325872189983e50ba536274133e3cf9f95a8560f30","path":"revisions/0001/public-release-status-set.dsse.v0.1.json","role":"status-signature","size":2357},{"file_digest":"sha256:444667a1b607a6f50a72aa116e70df59c754e4148e3cc6f4e2796021a062d5ba","path":"revisions/0001/public-release-status-set.v0.1.json","role":"status-set","size":1461},{"file_digest":"sha256:00eeb9413112d67a47945eeab8b34e9d76dae3d4a796beb307826d6a0ff3ab17","path":"revisions/0002/public-release-status-set.dsse.v0.1.json","role":"status-signature","size":2549},{"file_digest":"sha256:7d6b9fe9993395d9d1735da4a2a439b8343cc5322c1eba9e1d070203b1f6c0dc","path":"revisions/0002/public-release-status-set.v0.1.json","role":"status-set","size":1605}],"latest_revision":2,"latest_status_set_digest":"sha256:31c4dd00af438342e863e252e83c844dd2e69ab379013029e2b08220409830c1","output_set_digest":"sha256:eecd847fe7f0b4a314b06fd3edfad29ceebcfb8f631a2578fb3c25aadbbf0189","schema_version":"0.1","self":{"digest_field":"output_set_digest","path":"public-release-status-chain-output-set.v0.1.json"},"trust_domain_id":"itdo-private-match-assurance-fixture-v0.1"}