{"artifact_status":"test-only","chain_manifest_digest":"sha256:ca844a655be5c0684f052fa1da01c43e523d3e042cd78f71a1524b59874f0358","chain_tree_digest":"sha256:901a029962f7777e636d0b676aa1c85d7bd40823fbe958f003c84868aa7e0be0","exact_paths":["chain-manifest/public-release-status-chain-manifest.v0.1.json","public-release-status-chain-output-set.v0.1.json","revisions/0001/public-release-status-set.dsse.v0.1.json","revisions/0001/public-release-status-set.v0.1.json","revisions/0002/public-release-status-set.dsse.v0.1.json","revisions/0002/public-release-status-set.v0.1.json"],"files":[{"file_digest":"sha256:c4f02be7aeac7e54c38404111ce2eee24de18f2e6f8f2d17be500b0b2a201676","path":"chain-manifest/public-release-status-chain-manifest.v0.1.json","role":"status-chain-manifest","size":2101},{"file_digest":"sha256:12879b1a9facf3ab4c64965713e8af9aa88d6165b11a2ee897578f976347f0bc","path":"revisions/0001/public-release-status-set.dsse.v0.1.json","role":"status-signature","size":2357},{"file_digest":"sha256:a8c51ada0ecfb01b1d73833fcbc216e8405460754d51f1b6bf431ff92af06fb7","path":"revisions/0001/public-release-status-set.v0.1.json","role":"status-set","size":1461},{"file_digest":"sha256:02daec7b7a3dce2c8a20c86f0a0b8f62678658f999f889d52037d4775df798db","path":"revisions/0002/public-release-status-set.dsse.v0.1.json","role":"status-signature","size":2609},{"file_digest":"sha256:a9c87d22723443866bc15bd39bcdf781bc59a9c54a64476d9a95e1fe11e6552b","path":"revisions/0002/public-release-status-set.v0.1.json","role":"status-set","size":1650}],"latest_revision":2,"latest_status_set_digest":"sha256:8bfef2bf0a7551ca99d7a3a84af7e2181124e889d49f0fe39f0de798e1a57d14","output_set_digest":"sha256:696153a41ab8a70a9e32b3cadb7af1c6e297eef87bf448b3104085e82ce0ffb2","schema_version":"0.1","self":{"digest_field":"output_set_digest","path":"public-release-status-chain-output-set.v0.1.json"},"trust_domain_id":"itdo-private-match-assurance-fixture-v0.1"}